{"事件":{"开启":false,"结束":false,"标题":"","阶段":"","已完成事件":[]},"世界":{"时间":"","地点":""},"任务列表":{},"主角":{"姓名":"","描述":"","种族":"","身份":[],"职业":[],"生命层级":"第一层级/普通","等级":1,"累计经验值":0,"升级所需经验":120,"冒险者等级":"未评级","属性点":0,"属性":{"力量":0,"敏捷":0,"体质":0,"智力":0,"精神":0},"生命值上限":0,"生命值":0,"法力值上限":0,"法力值":0,"体力值上限":0,"体力值":0,"状态效果":{},"金钱":0,"装备":{},"背包":{},"技能":{}},"命运点数":0,"关系列表":{},"地图":{"标记":[{"id":"marker-1768939468928-814f03","name":"梵尼亚","group":"超巨型城邦","description":"云巅圣域的秩序之翼:“凡间的君王追逐泥土里的权柄，荒原的蛮族在尘埃中嘶吼。而我们，生于极境之巅，沐浴初光之洗礼。在辉煌女神的注视下，圣纹不仅是力量的投影，更是灵魂纯净的铁证。收起你那贪婪的凡心，在这里，唯有绝对的礼制与洁白的羽翼，方可通往神谕的真理。”\\n\\n高悬于神迹山脉主峰“天空圣域”之上的梵尼亚，是大陆上唯一的翼民神权教国，亦是辉煌女神信仰的绝对核心。其标识——白色羽翼守护金色圣杯，象征着其立国之本：纯洁、秩序与永恒的神谕。在云海与断崖环绕的垂直礼制之城中，白石台地与金纹穹顶层层叠构，从外环的工坊起降场到浮岛圣域的大圣殿，每一寸空间都严苛遵循着神权的阶序。\\n\\n在这里，教皇与圣女拥有至高无上的权威，圣翼骑士团作为大陆最强的空中武装，守卫着这片不容亵渎的空域。梵尼亚的子民以诚实守诺为荣，他们的地位紧密维系于“圣纹”的强度与羽翼的洁白度。尽管近期内部暗流涌动，但对外，它依然是那座俯瞰众生的不落圣都。无论是山脚聚集地卑微仰望的朝圣者，还是内环议事厅的高阶司祭，都深信唯有虔诚的仪式方能触达神明。对于凡世而言，梵尼亚不仅是一个国家，它更是高悬在众生头顶那道纯洁、神圣且高傲的光辉。","icon":"fa-solid fa-flag","color":"#ffd43b","position":{"nx":0.4063314078604598,"ny":0.4996493248955748},"imageUrls":["https://files.catbox.moe/7qh8f4.png","https://files.catbox.moe/lh07jr.png","https://files.catbox.moe/5ivxx1.png","https://files.catbox.moe/huyl0f.png","https://files.catbox.moe/sf7hhv.png"]},{"id":"marker-1769056290750-23280d","name":"奥古斯提姆帝国","group":"帝国","description":"诸界余晖下的永恒霸权:“我们不乞求神明的怜悯，也不依赖自然的馈赠。奥古斯提姆的每一寸疆土，都是用剑刃从世界手中夺来的。在女皇陛下的注视下，软弱是唯一的原罪，而征服是最高的敬意。”\n\n在大陆东部的广袤平原上，奥古斯提姆帝国的双头狮鹫旗帜是唯一被允许飘扬的色彩——金色象征着金谷城无尽的麦浪与财富，深红色则象征着铁炉堡为了捍卫秩序所流淌的铁血。作为当前人类文明中军事实力最强的霸主，帝国本身就是一座森严的壁垒。在其首都“辉光之城”艾瑟嘉德，第六层级的至高统治者维奥莱塔·马克西姆·奥古斯塔女皇，以她不容置疑的权威掌控着波流斯、霍亨伯格等六大古老家族的命运。在这里，法律允许你向任何神明祈祷，但你的剑与忠诚必须属于帝国。面对西境卡拉什利亚斯兽族联盟的咆哮，以及位面入侵留下的阴影，奥古斯提姆展现出了令人战栗的务实与强势——它不寻求被爱戴，只要求被服从。","icon":"fa-solid fa-flag","color":"#000000","position":{"nx":0.4921537970278792,"ny":0.585453526933717},"imageUrls":["https://files.catbox.moe/xvfs6x.png"]},{"id":"marker-1769056415092-127f9c","name":"卡拉什利亚斯","group":"兽族联盟","description":"风痕草原的咆哮之魂:\n“奥古斯提姆人用石墙圈禁土地，梵尼亚人在云端傲慢俯视，唯有我们，追随着巡天巨兽的足迹，在大地上自由奔跑。”\n\n占据着大陆中西部广袤“无尽风痕草原”与圣地“天镜湖”的卡拉什利亚斯，是由七大古老兽人氏族缔结的强大游牧联邦。他们的旗帜在狂风中猎猎作响——底色是象征灵魂自由的“天青”，泼洒着象征生存残酷的“血红”，中央那巨大的“巡天巨兽蹄印”昭示着他们是这片大地最正统的继承者。\n\n在这里，霸主与联盟议会共同维系着某种粗犷而神圣的平衡：狼族的智慧勇猛、熊族的力量凶残、半人马的高傲与疾驰与蝾螈族的神秘元素力量融为一体。他们并非帝国口中嗜血的蛮族，而是极其重视“血誓盟约”的高贵战士。为了生存，他们敢于向东方的奥古斯提姆帝国铁骑发起冲锋；为了信仰，他们亦敢于向盘踞高空的死敌——翼民圣都梵尼亚拉开复仇的长弓。对于卡拉什利亚斯的子民而言，死亡并非终结，而是回归先祖之灵的荣耀归途。","icon":"fa-solid fa-flag","color":"#ffcc66","position":{"nx":0.2753470404339567,"ny":0.5741053152564995},"imageUrls":["https://files.catbox.moe/1p3t8n.png"]},{"id":"marker-1769056380399-32cef0","name":"诺斯加德联盟","group":"公国联盟","description":"凛冬之境的霜狼兄弟会:\n“南方的软弱贵族用丝绸包裹身体，而我们用霜雪磨砺骨骼。在这里，没有皇帝的权杖，只有五把交叉的战斧——当来自永冻冰原的魔潮涌来时，记住我们的盟约：孤狼死，群狼生。”\n\n诺斯加德联盟并非一个统一的国家，而是一道由钢铁、冰雪与誓言筑成的防线。它位于大陆的最北端，由斯卡尔、诺德海姆等五个独立公国组成。这里的环境恶劣至极，但也造就了诺斯加德人坚韧务实的性格。在那面“雪狼头与交叉战斧”的旗帜下，五位大公在首都霜铁城的圆桌前共商国是。\n\n比起帝国的繁文缛节，诺斯加德人更信奉手中的利刃与身边的战友。他们虽然也信仰“四圣灵”，但他们的神坛上往往供奉着战死的先祖头骨。为了抵御北方永冻冰原上肆虐的霜巨人与魔物潮，这五个性格迥异的公国放下了往日的恩怨，缔结了神圣的“霜狼盟约”。在每一个迎冬节的夜晚，诺斯加德的篝火都会连成一片，那是人类文明在极北黑暗中最后且最亮的光芒。","icon":"fa-solid fa-flag","color":"#ffffff","position":{"nx":0.6363216511884194,"ny":0.3419665180172734},"imageUrls":["https://files.catbox.moe/sshwvp.png"]},{"id":"marker-1768996974613-25ecc3","name":"伯伦斯法环","group":"超巨型城邦/魔法学院","description":"星轨下的守望者：“我们并非为了避世而登高，亦非为了权柄而集结。当位面交汇的裂痕初次在大地蔓延时，吾辈便立下誓约：此世不应在无知中倾覆。伯伦斯法环伫立于云端，以凡人之躯，为万物测绘那不可见的法则边界。在这里，真理即是责任，观测即是守护。”位于大陆东北沿海六千米高空的伯伦斯法环，是第一次位面战争余晖中建立的法师圣所。它是一座精密运转的观测枢纽，核心“公理圣球”正如一颗永不闭合的眼瞳，时刻校准着阿斯塔利亚位面与虚海间的维度偏差。日冕、月帷、衔尾蛇三院的法师们在此摒弃了凡俗的纷争，他们审视星辰的轨迹，探求着那把足以抵御下一次灾难的真理之钥。法理的余晖从高天垂落，化作了凡世生存的脉动。雾晶港以务实且充满生命力的姿态，成为了连接法环与凡世的门户。这座终年被雨雪与符文微光笼罩的都市，是技术与野心的交汇之地。实验沉降的“三色海雾”在此被捕雾者从波涛中悉数采撷，经由炼金术士之手，将不稳定的灵光凝结为支撑城市运转的晶簇。座落于此的雾晶学院以“心智驾驭奥秘”为训，如同一座熔炉源源不断地吸纳着世界各地的天才，磨砺着那些有望穿过云层、进入法环殿堂的灵魂。每逢十二月，当法环切断一切对外联系，进入封闭观测期时，公理圣球激发的极光将如垂帘般覆盖整个天际。下方的雾晶港亦会随之迎来盛大的“星轨祭”——在祭典最后一天的烟火大会中，璀璨的花火将跃入冬夜，与高天的极光交织共鸣。那一刻，凡世的喧嚣与高天的真理彼此致意，以此慰藉那些在迷雾中为世界守望了整年的灵魂。","icon":"fa-solid fa-flag","color":"#000000","position":{"nx":0.6595921611894227,"ny":0.5390095104958678},"imageUrls":["https://files.catbox.moe/3x1ifs.png","https://files.catbox.moe/di0b4b.png","https://files.catbox.moe/d8teyc.png","https://files.catbox.moe/89evc3.png","https://files.catbox.moe/uc5912.png","https://files.catbox.moe/b4tjot.png","https://files.catbox.moe/d8cv0k.png","https://files.catbox.moe/n184aa.png","https://files.catbox.moe/0jb1u0.png"]},{"id":"marker-1769056345880-422222","name":"索伦蒂斯王国","group":"王国","description":"不夜的潮汐与欲望之声:\n“奥古斯提姆人为了荣誉而死，兽人为了先祖而死，而在索伦蒂斯，我们只为了快乐而活。只要金币还在叮当作响，霓虹灯火便永不熄灭。”\n\n位于大陆东南沿海的索伦蒂斯王国，是全大陆最接近“现代文明”形态的异类国度。在这里，夜晚并不意味着黑暗，而是意味着珍珠湾的赌盘刚刚转动，银帆城的黑市刚刚开张。那面“缠绕黄金三叉戟的人鱼姬”徽章飘扬之处，空气中永远弥漫着海盐、香水与金币混合的味道。\n\n这是一个由人类与海族共同统治的“双核君主国”。端坐在首都潮汐王座之上的，是美艳绝伦的安娜斯塔西娅·佛罗伦丝·索伦蒂斯女王。作为一名拥有一半人鱼血统的第六层级强者，她本身就是这个国家最大的象征：危险、迷人且包容万象。在索伦蒂斯，信条简单而粗暴：“万物皆可交易，欲望即是自由。” 这里没有严苛的法律，没有绝对的道德，如果你感到痛苦或束缚，那只能说明你手中的筹码还不够多。","icon":"fa-solid fa-flag","color":"#4dabf7","position":{"nx":0.6650034812787284,"ny":0.8010846912862142},"imageUrls":["https://files.catbox.moe/a2kr2f.png"]},{"id":"marker-1769069516461-f95214","name":"萨赫拉联邦","group":"沙漠联邦","description":"赤金沙海的日蚀双子:\n“帝国的孩子们渴望神明的垂怜，而在萨赫拉，我们只相信杠杆、齿轮与计算出的未来。在这里，要么成为执掌齿轮的人，要么成为被齿轮碾碎的灰尘。”\n\n位于大陆南方的萨赫拉联邦，是一个建立在无尽荒漠中的城邦文明圈。它不以魔力见长，却凭借着冠绝大陆的非魔法工程科技，在赤金沙海中开辟出了脆弱而繁荣的疆域。那面“黄金太阳”旗帜下，金色象征着取之不尽的财富与烈日，绿色则象征着珍贵的生命水源与通过技术维持的绿洲。\n\n这是一个“双首、双心”的复杂文明。明面上，首都阿兹哈尔在法里斯家族的统治下，展现着由奴隶的叹息和工程师的精密算计堆砌而成的辉煌；暗地里，另一座首都——影之城阿勒穆特，则由第六层级的领袖哈桑·伊本·萨巴赫掌控着大陆最尖端的暗杀与情报网。萨赫拉的行事风格极其务实且残忍：“强胜弱汰，财富为尊”。在这里，科学不是造福众生的工具，而是统治阶层手中最锋利的刃。","icon":"fa-solid fa-flag","color":"#ffd43b","position":{"nx":0.49956465300840563,"ny":0.7057386682369069},"imageUrls":["https://files.catbox.moe/x6c9dq.png"]},{"id":"marker-1772184942291-b0031e","name":"艾尔文海姆","group":"文明","description":"艾尔文海姆并非一块由疆界划分的国土，而是一首活着的、与世界共同呼吸的交响乐章。这片被称为“翡翠之心”的古老林地，便是那曲乐章的实体。精灵们相信，脚下的土地、林间的风、流淌的溪水，皆是世界树沉睡梦境中溢出的一个音符。要进入此地，旅者无需通行文书，却需接受整片森林的“聆听”：你的灵魂便是你的乐器，若你心中怀有和谐的旋律，森林将为你谱出通路；若你心藏刺耳的杂音，这片土地本身就会成为一座无法逾越的、由万千树木构成的无声屏障。","icon":"fa-solid fa-flag","color":"#63e6be","position":{"nx":0.19305254128703805,"ny":0.785852232141142},"imageUrls":["https://files.catbox.moe/ejipap.png"]},{"id":"marker-1769427055385-23e64c","name":"边陲之国","group":"DLC内容/巨型城邦/遗迹/中危区域（☆☆☆）","description":"若你的理智能侥幸穿过雷林的轰鸣与迷雾低语，便会抵达南方那片被永恒阴霾笼罩的死寂之地——“边陲之国”。这是一座占地五十万平方公里的宏大废墟，一场永不停歇的“污秽之雨”彻底扭曲了这里的时空与法则。在这里，雨水不再是生命的恩赐，而是记忆的毒药：它能侵蚀物质、固化痛苦，将生者转化为丧失理智的活尸，让亡者化作充满怨念的怪物。从外围悬崖村那相对“安宁”的疯癫，到中层魔女森林中魔法与自然交织的畸变，再到内层王城那深不见底的黑暗，每一步深入都是对认知的凌迟。而在那一切腐化的尽头，污秽之王正端坐在现实的最深处，与白巫女的悲剧命运纠缠共生，等待着有人能终结这场漫长的、关于毁灭的梦魇。","icon":"fa-solid fa-city","color":"#845ef7","position":{"nx":0.3420753242708851,"ny":0.9027562622783062},"imageUrls":["https://files.catbox.moe/21hceo.png","https://files.catbox.moe/mbi8io.jpg","https://files.catbox.moe/2dodfn.jpg","https://files.catbox.moe/hziiyk.jpg","https://files.catbox.moe/8py4oy.png","https://files.catbox.moe/ze5r5l.jpg"]},{"id":"marker-1768996037327-30fd69","name":"艾瑟嘉德","group":"巨型城邦","description":"若你渴望目睹那道横跨天穹的奇迹，就必须前往帝国的首都——“辉光之城”艾瑟嘉德。传说中，初代皇帝曾用一块完整的魔法水晶雕刻出了那座宏伟的“白金拱桥”。这不仅仅是建筑，更是神权的精密仪器：每当黎明破晓，第一缕阳光会穿过剔透的桥拱，精准地照亮皇宫那刺破云霄的尖顶之下的王座，臣民们坚信，那是太阳在向他们的统治者致意。而在盛大的“双狮鹫节”，这种威严将达到顶峰——皇帝陛下会在真正的双头狮鹫伴飞下巡视苍穹，向整座大陆宣告帝国不可侵犯的至高权柄。","icon":"fa-solid fa-city","color":"#000000","position":{"nx":0.5271658246953523,"ny":0.5334719892322212},"imageUrls":["https://files.catbox.moe/sk9fom.png","https://files.catbox.moe/vz75p4.png","https://files.catbox.moe/y93pzm.png","https://files.catbox.moe/wclssh.png","https://files.catbox.moe/xo7cjh.png","https://files.catbox.moe/023yu0.png","https://files.catbox.moe/whe9tz.png"]},{"id":"marker-1768995991158-bae653","name":"白石修道院","group":"大型村庄","description":"在艾瑟嘉德以北，当首都辉煌的金顶逐渐在视野中隐去，你会来到一个名为“白石”的静谧村庄。这里没有狮鹫的嘶鸣，只有一座朴素的修道院伫立在平缓的山坡之上，俯瞰着尘世。不同于皇宫的精雕细琢，白石修道院由粗糙的灰白色岩石堆砌而成，墙缝里长满了倔强的青苔。这里是帝国退役老兵和苦行僧的归宿，他们常会对过往的旅人讲述那个关于修道院基石的古老寓言——以此告诫世人，在艾瑟嘉德的万丈光芒之外，还有另一种活着的方式。","icon":"fa-solid fa-location-dot","color":"#000000","position":{"nx":0.5318397375721008,"ny":0.49093855381436147},"imageUrls":["https://files.catbox.moe/hicdto.png"]},{"id":"marker-1768995856860-0a5300","name":"金谷城","group":"大型城邦","description":"若你想见识何为真正的富饶，务必造访东部的金谷城。这座被无尽金黄麦浪所环绕的城市，不仅供应着帝国贵妇餐桌上最精致的面包，更矗立着如山丘般宏伟的“金穗粮仓”，里面贮藏着足以支撑帝国十年的收成。繁忙的运河之上，往来船只多如过江之鲫，船夫们在丰收的歌谣中传唱着商人们最引以为傲的信条：只要金谷城的粮仓不空，帝国的千军万马便永远不会挨饿，皇室的荣光亦永不熄灭——这，才是比黄金更坚挺的底气。","icon":"fa-solid fa-city","color":"#000000","position":{"nx":0.5627536738905705,"ny":0.5530584089561045},"imageUrls":["https://files.catbox.moe/ulcasg.png","https://files.catbox.moe/yjt01h.png","https://files.catbox.moe/a0ipg3.png","https://files.catbox.moe/t0zn0u.png"]},{"id":"marker-1768995818797-cf18d4","name":"风车镇","group":"城镇","description":"路过风车镇，你不仅要瞻仰那些如不知疲倦的巨人般日夜旋转的巨大磨坊，更要留意它们独特的名号——这里的每一座风车，都以一位美丽少女的名字命名。这是因为当地的酿酒师坚信，风是有情绪的，唯有像对待情人般温柔相待，它才会将金色的麦粒磨出最醇正的香气。在这里，你务必要尝尝那传说中的麦酒，它不仅融合了阳光、土地与微风的温柔以抚慰旅途的疲惫，更藏着一种独特的野性：据说最好的酒总是在风暴过后的第一个晴天酿成，因此在回甘之中，至今仍带着一丝雷霆的辛烈。","icon":"fa-solid fa-location-dot","color":"#000000","position":{"nx":0.5913820199643719,"ny":0.5645932495000443},"imageUrls":["https://files.catbox.moe/23dr4u.png","https://files.catbox.moe/nvil36.png","https://files.catbox.moe/vjq48z.png"]},{"id":"marker-1768995786400-71d0f5","name":"银溪镇","group":"城镇","description":"帝国贵族们以佩戴银溪镇的饰品为荣，因为这里的工匠从不使用模具，他们坚信每一件能闪烁月光、低语星辰的银器都应拥有独一无二的灵魂。然而，当你真正走近这座艺术圣地，却会发现某种令人不安的代价：连林间的树木都已被侵蚀，泛着诡异的死寂银灰；那条穿城而过的小河曾清澈见底，如今却因重金属的淤积而闪烁着不祥的光泽。对此，工匠们始终缄口不言，他们只是在逐渐死去的土地上默默打磨着那些令世人趋之若鹜的杰作，仿佛只要银器的光芒足够耀眼，便能掩盖这背后早已被毒害的一切。","icon":"fa-solid fa-location-dot","color":"#000000","position":{"nx":0.5858631266299695,"ny":0.6098565765682675},"imageUrls":["https://files.catbox.moe/itugsq.png","https://files.catbox.moe/wclx1t.png","https://files.catbox.moe/myh49c.png"]},{"id":"marker-1768996224821-2cec8b","name":"红叶镇","group":"城镇","description":"若说艾瑟嘉德是帝国的头脑，铁炉堡是帝国的拳头，那么夹在两者之间的红叶镇，便是帝国那颗感性而跃动的心脏。这条连接辉煌皇都与钢铁西境的必经之路上，生长着延绵十里的古老枫林。每当深秋，漫天红叶如烈火般燃烧，将天空与大地染成一片凄艳的绯红。对于前往西境服役的士兵而言，这如血的红叶是他们告别繁华世界前的最后一次温柔回眸；而对于从前线归来的老兵，那在风中沙沙作响的枫林，则是洗去一身硝烟与铁锈味、重返人间的第一声问候。","icon":"fa-solid fa-location-dot","color":"#000000","position":{"nx":0.4762737913239826,"ny":0.5490559609601561},"imageUrls":["https://files.catbox.moe/jdj0z7.png","https://files.catb